{"artifacts":[{"bytes":494,"digest":"sha256:bbbfe40e40f220301de43bcb18edd7c85e0e85162176dde109363ed869fff356","kind":"manifest","path":"plugins/org.alica.echoa/index.json"},{"bytes":424,"digest":"sha256:58ee9f01fb4948faf71ed7a3468d55563f3117faccecb8a3b1ebc81ff0aee649","kind":"descriptor","path":"plugins/org.alica.echoa/contracts/c0.json"},{"bytes":451,"digest":"sha256:4ad8c2ede6a8224c643078807f644c053fca29179546889ad59e28fbebe09e0b","kind":"manifest","path":"plugins/org.alica.echoa/manifest.json"},{"bytes":845,"digest":"sha256:9c6e00f7fa07f8b0fb579e2ed03f1afa7023b2bfe0692936114e37383a1e5dfe","kind":"plugin","path":"plugins/org.alica.echoa/code/index.js"},{"bytes":498,"digest":"sha256:a0f8143f73812f9f9fc7f8d0856523397a4c3fdb77b0e74a35bfd8b1313aab75","kind":"manifest","path":"plugins/org.alica.consumer/index.json"},{"bytes":428,"digest":"sha256:0ef2f30880956bd7e5d2bbab948573d55bd9d756170881193f25259c0c8fd000","kind":"descriptor","path":"plugins/org.alica.consumer/contracts/c0.json"},{"bytes":550,"digest":"sha256:f8b2e71b3b10b3bedc4d1ed90ca95f434a1cce705aa3ba2d9c3b6893ad11ddfd","kind":"manifest","path":"plugins/org.alica.consumer/manifest.json"},{"bytes":1144,"digest":"sha256:e0522ba07461ff9cfe69a3350866107ad5766c2804a05ee6323e6fd7c18e2b69","kind":"plugin","path":"plugins/org.alica.consumer/code/index.js"},{"bytes":370,"digest":"sha256:69bfa3ce25fe967bbfa054888d22f42a2a2aa958d77138d84c54ebeda05279bd","kind":"manifest","path":"plugins/org.alica.client/index.json"},{"bytes":367,"digest":"sha256:107541f5de58c2adac4698bd172abbe4f3dc53a4dbbe95a204ad834a446dc6b0","kind":"manifest","path":"plugins/org.alica.client/manifest.json"},{"bytes":35,"digest":"sha256:ef2ed2a9ec4c6f3cd911387ade1ea2823f0962502579211f9281cbb94fab9121","kind":"plugin","path":"plugins/org.alica.client/code/index.js"},{"bytes":559,"digest":"sha256:a48428faaf22d426078feb215a2adde17e7aa1d6de9b4290fb9c297cf10f654a","kind":"profile","path":"profile/profile.json"},{"bytes":11,"digest":"sha256:999d412febdcd686cbcb86c753139405308ed372566ff1c188578e67b79c979a","kind":"runtime","path":"runtime/fixture.txt"},{"bytes":2,"digest":"sha256:44136fa355b3678a1146ad16f7e8649e94fb4fc21fe77e8310c060f61caaff8a","kind":"runtime","path":"schemas/fixture.json"},{"bytes":13,"digest":"sha256:23472d77cf14065f05744d9159c2c53595dc0c3126867382ca47091106f1a3ba","kind":"documentation","path":"docs/fixture.txt"},{"bytes":16,"digest":"sha256:ffbc2dfc402782325da71132100e74ff511d1585dd80e4ea196ed4bcace3fef2","kind":"sbom","path":"sbom/sbom.json"},{"bytes":16,"digest":"sha256:ffbc2dfc402782325da71132100e74ff511d1585dd80e4ea196ed4bcace3fef2","kind":"provenance","path":"provenance/build.json"},{"bytes":373,"digest":"sha256:5113a90b55abbea213e2617d2751f7ccd12d5faaeac445e7d86e2b3158f6e2a0","kind":"manifest","path":"trust/policy.json"},{"bytes":208,"digest":"sha256:537e5cda29faeb589507306f34e52695e16765054acc25598204a8052cddbb32","kind":"manifest","path":"trust/policy-signature.json"},{"bytes":153,"digest":"sha256:cdb6fda9d0cf68af60c4b83ae0bce2829fde2f5b89a577e308c50269e7901496","kind":"manifest","path":"trust/revocation.json"},{"bytes":208,"digest":"sha256:c28216cc515e450920b41c1a1fbb784fd2707ab634b5af219c3d5120dd3ffc7e","kind":"manifest","path":"trust/revocation-signature.json"},{"bytes":1338,"digest":"sha256:27a2808376a905af42960e48e6c476444c5faba098abf0f137f919b130f22626","kind":"manifest","path":"profile/lock.json"}],"bundleId":"cell-test","profileDigest":"sha256:a48428faaf22d426078feb215a2adde17e7aa1d6de9b4290fb9c297cf10f654a","schemaVersion":"alica.bundle/v1"}