{"artifacts":[{"bytes":494,"digest":"sha256:ac889bcfae96e49e237eac70d9758970a7b93c583447d7bbe98d659857dbf664","kind":"manifest","path":"plugins/org.alica.echoa/index.json"},{"bytes":424,"digest":"sha256:58ee9f01fb4948faf71ed7a3468d55563f3117faccecb8a3b1ebc81ff0aee649","kind":"descriptor","path":"plugins/org.alica.echoa/contracts/c0.json"},{"bytes":451,"digest":"sha256:e54143ef678a94cf7d4067eea887972e5f2f737f810cd0658e50601e5a9ceb74","kind":"manifest","path":"plugins/org.alica.echoa/manifest.json"},{"bytes":533,"digest":"sha256:48afc6e71cb66fb0f84d80455838f5ff2b49b9fbb419459c1bf1933ff6a68429","kind":"plugin","path":"plugins/org.alica.echoa/code/index.js"},{"bytes":498,"digest":"sha256:a0f8143f73812f9f9fc7f8d0856523397a4c3fdb77b0e74a35bfd8b1313aab75","kind":"manifest","path":"plugins/org.alica.consumer/index.json"},{"bytes":428,"digest":"sha256:0ef2f30880956bd7e5d2bbab948573d55bd9d756170881193f25259c0c8fd000","kind":"descriptor","path":"plugins/org.alica.consumer/contracts/c0.json"},{"bytes":550,"digest":"sha256:f8b2e71b3b10b3bedc4d1ed90ca95f434a1cce705aa3ba2d9c3b6893ad11ddfd","kind":"manifest","path":"plugins/org.alica.consumer/manifest.json"},{"bytes":1144,"digest":"sha256:e0522ba07461ff9cfe69a3350866107ad5766c2804a05ee6323e6fd7c18e2b69","kind":"plugin","path":"plugins/org.alica.consumer/code/index.js"},{"bytes":370,"digest":"sha256:69bfa3ce25fe967bbfa054888d22f42a2a2aa958d77138d84c54ebeda05279bd","kind":"manifest","path":"plugins/org.alica.client/index.json"},{"bytes":367,"digest":"sha256:107541f5de58c2adac4698bd172abbe4f3dc53a4dbbe95a204ad834a446dc6b0","kind":"manifest","path":"plugins/org.alica.client/manifest.json"},{"bytes":35,"digest":"sha256:ef2ed2a9ec4c6f3cd911387ade1ea2823f0962502579211f9281cbb94fab9121","kind":"plugin","path":"plugins/org.alica.client/code/index.js"},{"bytes":559,"digest":"sha256:d2807260b7b67661b08b84c0bcf1e38351a285aa09a62dd13800f6fcec291b44","kind":"profile","path":"profile/profile.json"},{"bytes":11,"digest":"sha256:999d412febdcd686cbcb86c753139405308ed372566ff1c188578e67b79c979a","kind":"runtime","path":"runtime/fixture.txt"},{"bytes":2,"digest":"sha256:44136fa355b3678a1146ad16f7e8649e94fb4fc21fe77e8310c060f61caaff8a","kind":"runtime","path":"schemas/fixture.json"},{"bytes":13,"digest":"sha256:23472d77cf14065f05744d9159c2c53595dc0c3126867382ca47091106f1a3ba","kind":"documentation","path":"docs/fixture.txt"},{"bytes":16,"digest":"sha256:ffbc2dfc402782325da71132100e74ff511d1585dd80e4ea196ed4bcace3fef2","kind":"sbom","path":"sbom/sbom.json"},{"bytes":16,"digest":"sha256:ffbc2dfc402782325da71132100e74ff511d1585dd80e4ea196ed4bcace3fef2","kind":"provenance","path":"provenance/build.json"},{"bytes":373,"digest":"sha256:f9fd09724620f290480775ce3d929830d89c43b9c6ae0856a2b51a63f15b1534","kind":"manifest","path":"trust/policy.json"},{"bytes":208,"digest":"sha256:bcad1cfba58aaad28c409d8f76d3464cac0d4f9b5380dce9f466cb9bf3089783","kind":"manifest","path":"trust/policy-signature.json"},{"bytes":153,"digest":"sha256:0026cb82a6fd71f367bad31c557ca63c0eb2b068c19a238e79ae5c452babb91d","kind":"manifest","path":"trust/revocation.json"},{"bytes":208,"digest":"sha256:dac128e13939cf1b2088552a29cb1e3699870f4958039ac3f40ce4de3159b87a","kind":"manifest","path":"trust/revocation-signature.json"},{"bytes":1338,"digest":"sha256:9854a540646c07efd8cc245bcd38f917e5f1f44beaf53fd446799adcca13a40f","kind":"manifest","path":"profile/lock.json"}],"bundleId":"cell-test","profileDigest":"sha256:d2807260b7b67661b08b84c0bcf1e38351a285aa09a62dd13800f6fcec291b44","schemaVersion":"alica.bundle/v1"}