{"artifacts":[{"bytes":494,"digest":"sha256:82adcb1bce1597227fb0764be403555ae02fc3f896aa07eea0b83ab10bb63b35","kind":"manifest","path":"plugins/org.alica.echoa/index.json"},{"bytes":424,"digest":"sha256:58ee9f01fb4948faf71ed7a3468d55563f3117faccecb8a3b1ebc81ff0aee649","kind":"descriptor","path":"plugins/org.alica.echoa/contracts/c0.json"},{"bytes":451,"digest":"sha256:e54143ef678a94cf7d4067eea887972e5f2f737f810cd0658e50601e5a9ceb74","kind":"manifest","path":"plugins/org.alica.echoa/manifest.json"},{"bytes":543,"digest":"sha256:efe4b336ddc655a4a04bb20b7129cbf81603bb4ab0a2bbedfb370ca2fba5ec2b","kind":"plugin","path":"plugins/org.alica.echoa/code/index.js"},{"bytes":498,"digest":"sha256:a0f8143f73812f9f9fc7f8d0856523397a4c3fdb77b0e74a35bfd8b1313aab75","kind":"manifest","path":"plugins/org.alica.consumer/index.json"},{"bytes":428,"digest":"sha256:0ef2f30880956bd7e5d2bbab948573d55bd9d756170881193f25259c0c8fd000","kind":"descriptor","path":"plugins/org.alica.consumer/contracts/c0.json"},{"bytes":550,"digest":"sha256:f8b2e71b3b10b3bedc4d1ed90ca95f434a1cce705aa3ba2d9c3b6893ad11ddfd","kind":"manifest","path":"plugins/org.alica.consumer/manifest.json"},{"bytes":1144,"digest":"sha256:e0522ba07461ff9cfe69a3350866107ad5766c2804a05ee6323e6fd7c18e2b69","kind":"plugin","path":"plugins/org.alica.consumer/code/index.js"},{"bytes":370,"digest":"sha256:69bfa3ce25fe967bbfa054888d22f42a2a2aa958d77138d84c54ebeda05279bd","kind":"manifest","path":"plugins/org.alica.client/index.json"},{"bytes":367,"digest":"sha256:107541f5de58c2adac4698bd172abbe4f3dc53a4dbbe95a204ad834a446dc6b0","kind":"manifest","path":"plugins/org.alica.client/manifest.json"},{"bytes":35,"digest":"sha256:ef2ed2a9ec4c6f3cd911387ade1ea2823f0962502579211f9281cbb94fab9121","kind":"plugin","path":"plugins/org.alica.client/code/index.js"},{"bytes":559,"digest":"sha256:1fac907bc16f3283dfdff24936db147a02d0b21e38c04c45358438c0890f9549","kind":"profile","path":"profile/profile.json"},{"bytes":11,"digest":"sha256:999d412febdcd686cbcb86c753139405308ed372566ff1c188578e67b79c979a","kind":"runtime","path":"runtime/fixture.txt"},{"bytes":2,"digest":"sha256:44136fa355b3678a1146ad16f7e8649e94fb4fc21fe77e8310c060f61caaff8a","kind":"runtime","path":"schemas/fixture.json"},{"bytes":13,"digest":"sha256:23472d77cf14065f05744d9159c2c53595dc0c3126867382ca47091106f1a3ba","kind":"documentation","path":"docs/fixture.txt"},{"bytes":16,"digest":"sha256:ffbc2dfc402782325da71132100e74ff511d1585dd80e4ea196ed4bcace3fef2","kind":"sbom","path":"sbom/sbom.json"},{"bytes":16,"digest":"sha256:ffbc2dfc402782325da71132100e74ff511d1585dd80e4ea196ed4bcace3fef2","kind":"provenance","path":"provenance/build.json"},{"bytes":373,"digest":"sha256:1c78144e984dc0f20ac01f754f9a8e6717cac41909f420670032288f1cd761f4","kind":"manifest","path":"trust/policy.json"},{"bytes":208,"digest":"sha256:958db6b6d815d6853ade0161f5b27e518192ec12f4f4e7a2475cbf6f4e6f6708","kind":"manifest","path":"trust/policy-signature.json"},{"bytes":153,"digest":"sha256:041a719eb37252160dc104b9f8fff27aec0d96806b44df702cff9d24c8098b9e","kind":"manifest","path":"trust/revocation.json"},{"bytes":208,"digest":"sha256:f07ddc59f9bbe235eabfcbb4d49b947eeb9200cfcd96b38c696fdd15b395a3d6","kind":"manifest","path":"trust/revocation-signature.json"},{"bytes":1338,"digest":"sha256:9e7ea209724d53f6afe5666fa25346300376b6fa3e928d015c9a4de1317fc3f0","kind":"manifest","path":"profile/lock.json"}],"bundleId":"cell-test","profileDigest":"sha256:1fac907bc16f3283dfdff24936db147a02d0b21e38c04c45358438c0890f9549","schemaVersion":"alica.bundle/v1"}